{
  "$schema": "../../schemas/quotes.schema.json",
  "catalog_name": "Hâdimü'l-Harameyn: Birincil Kaynak Alıntıları ve Tarihsel Kelâm Külliyatı",
  "description": "Yavuz Sultan Selim dönemi (1512-1520) siyasi felsefesi, askeri sevk ve idaresi, hilafet anlayışı, tasavvufi derinliği ve çağdaş intibalarını yansıtan birincil kaynak metinleri ve orijinal alıntılar fihristi.",
  "total_quotes": 25,
  "quotes": [
    {
      "quote_id": "QTE-001",
      "speaker": "I. Selim (Yavuz Sultan Selim)",
      "speaker_title": "Osmanlı Padişahı ve İlk Osmanlı Halifesi",
      "year": 1516,
      "event_or_context": "Şam Emeviyye Camii Cuma Hutbesi (Mercidâbık Zaferi Sonrası)",
      "category": "hadimul_harameyn_ve_hilafet",
      "original_text": "لا تقل حاكم الحرمين الشريفين، بل خادم الحرمين الشريفين",
      "transcription": "Hâkimü'l-Haremeyni'ş-Şerîfeyn dimeñüz, bilakis Hâdimü'l-Haremeyni'ş-Şerîfeyn diyü nidâ eyleñüz!",
      "modern_turkish": "Bana Mekke ve Medine'nin Hâkimi demeyiniz; bilakis o iki mübarek mukaddes beldenin Hizmetkârı deyiniz!",
      "source_work": "Tâcü't-Tevârih (Cilt IV, s. 260)",
      "author": "Hoca Sâdeddin Efendi",
      "citation_reference": "Kültür Bakanlığı Yayınları, Ankara 1979, s. 260; Celâlzâde Selimnâme, s. 152.",
      "philosophical_commentary": "İslam siyaset teorisinde hükümdarlık kibrinin terk edilip mukaddes emanetler ve haremeyn karşısında acziyet ve hadimliğin (hizmetkârlığın) en yüce pâye kabul edildiği tarihi kırılma anıdır."
    },
    {
      "quote_id": "QTE-002",
      "speaker": "I. Selim (Yavuz Sultan Selim)",
      "speaker_title": "Osmanlı Padişahı",
      "year": 1514,
      "event_or_context": "Cihan Hâkimiyeti Mefkûresi ve Dünya Siyaseti Üzerine",
      "category": "cihan_hakimiyeti",
      "original_text": "این جهان یک پادشاه را بسنده نیست و دو پادشاه را تنگ است",
      "transcription": "Bu dünyâ bir pâdişâha yetecek kadar geniş ve büyük degildür; iki pâdişâha ise dardur.",
      "modern_turkish": "Bu dünya tek bir hükümdara yetecek kadar büyük değildir; iki hükümdara ise dardır.",
      "source_work": "Tevârih-i Âl-i Osmân, IX. Defter (Sultan Selim Devri)",
      "author": "İbn Kemal (Kemalpaşazâde)",
      "citation_reference": "TTK Yayınları, Haz. Şerafettin Turan, Ankara 1996, s. 42.",
      "philosophical_commentary": "Yavuz'un şark ve garbı tek bir nizam-ı âlem çatısı altında birleştirme arzusunu ve cihanşümul monarşi tasavvurunu özetleyen meşhur kelâm-ı kibârıdır."
    },
    {
      "quote_id": "QTE-003",
      "speaker": "I. Selim (Yavuz Sultan Selim)",
      "speaker_title": "Osmanlı Padişahı",
      "year": 1517,
      "event_or_context": "Ridâniye Zaferi ve Vezîriâzam Hadım Sinan Paşa'nın Şehadeti Üzerine",
      "category": "devlet_akli_ve_vezaret",
      "original_text": "مصر كبى بر اقليم الدق ولاكن قوجه سنان كبى بر وزير بيمثالى غائب ايلدك. مصر آنك قدرينه بها اولامز!",
      "transcription": "Mısır gibi bir iklîm aldık velâkin koca Sinân gibi bir vezîr-i bî-hemtâyı gâib eyledik. Mısır anuñ kadrine bahâ olamaz!",
      "modern_turkish": "Mısır gibi koskoca bir memleketi fethettik lakin koca Sinan gibi eşsiz bir veziri kaybettik. Mısır onun kıymetine bedel olamaz!",
      "source_work": "Tevârih-i Âl-i Osmân, IX. Defter",
      "author": "İbn Kemal (Kemalpaşazâde)",
      "citation_reference": "TTK Yayınları, s. 270; Celâlzâde Selimnâme, s. 188.",
      "philosophical_commentary": "Toprak kazanımının liyakatli, sadık ve dirayetli bir devlet adamının yerini dolduramayacağını haykıran, fatihin gözyaşlarıyla mühürlenmiş tarihi feryat."
    },
    {
      "quote_id": "QTE-004",
      "speaker": "I. Selim (Yavuz Sultan Selim)",
      "speaker_title": "Osmanlı Padişahı",
      "year": 1517,
      "event_or_context": "Sina Çölü Geçişi Esnasında Atından İnip Yaya Yürümesi",
      "category": "tasavvuf_ve_siir",
      "original_text": "Görmez misiz, öñümüzde Fahr-i Kâinât aleyhissalâtü vesselâm piyâde yürürken biz nice süvâr olavuz?",
      "transcription": "Görmez misiz, öñümüzde Fahr-i Kâinât aleyhissalâtü vesselâm piyâde yürürken biz nice süvâr olavuz?",
      "modern_turkish": "Görmüyor musunuz; önümüzde Âlemlerin Efendisi (s.a.v.) yaya yürürken biz nasıl at üstünde gidebiliriz?",
      "source_work": "Tâcü't-Tevârih (Cilt IV, s. 295)",
      "author": "Hoca Sâdeddin Efendi (Hasan Can'ın doğrudan rivayeti)",
      "citation_reference": "Kültür Bakanlığı Yayınları, Ankara 1979, s. 295.",
      "philosophical_commentary": "Ordunun susuzluk ve kavurucu kum fırtınasıyla boğuştuğu Sina çölünde padişahın manevi iklimi ve orduya aşıladığı metafizik cesaret."
    },
    {
      "quote_id": "QTE-005",
      "speaker": "I. Selim (Yavuz Sultan Selim)",
      "speaker_title": "Osmanlı Padişahı",
      "year": 1520,
      "event_or_context": "Osmanlı Hazine Mührü Fermanı ve Vasiyeti",
      "category": "adalet_ve_kanun",
      "original_text": "Benüm altın ile toldurduğum hazîneyi bundan sonra her kimse evlâdımdan altun ile toldurursa kendü mührüyle mühürlesün; hilâf-ı takdîrde Hazîne-i Hümâyûn benüm mührümle mühürlensün!",
      "transcription": "Benüm altun ile toldurduğum hazîneyi bundan sonra her kimse evlâdımdan altun ile toldurursa kendü mührüyle mühürlesün; hilâf-ı takdîrde Hazîne-i Hümâyûn benüm mührümle mühürlensün!",
      "modern_turkish": "Benim altınla doldurduğum devlet hazinesini bundan sonra evlatlarımdan ve torunlarımdan her kim altınla doldurursa kendi mührüyle mühürlesin; aksi takdirde Hazine-i Hümâyûn kıyamete dek benim mührümle mühürlensin!",
      "source_work": "Meâsir-i Selim Hânî (Selimnâme, s. 238)",
      "author": "Celâlzâde Mustafa Çelebi",
      "citation_reference": "MEB/TTK Neşri, s. 238; İbn Kemal IX. Defter, s. 310.",
      "philosophical_commentary": "Osmanlı İmparatorluğu'nun yıkılışına (1922) kadar Topkapı Sarayı İç Hazine kapısı daima Yavuz Sultan Selim'in kırmızı balmumu mührüyle açılıp kapanmıştır."
    },
    {
      "quote_id": "QTE-006",
      "speaker": "I. Selim (Yavuz Sultan Selim)",
      "speaker_title": "Osmanlı Padişahı",
      "year": 1514,
      "event_or_context": "Çaldıran Seferi Öncesi Şah İsmail'e Gönderilen Birinci Fetihnâme/Mektup",
      "category": "diplomasi_ve_nameler",
      "original_text": "Ben ki ser-leşker-i muzaffer-i İslâm ve şikest-i bünyâd-ı ehl-i bid'at olan Sultân Selîm Şâh bin Bâyezîd Hân'ım... Er isen meydâna gelesin, intizâr eylemeyesin!",
      "transcription": "Ben ki ser-leşker-i muzaffer-i İslâm ve şikest-i bünyâd-ı ehl-i bid'at olan Sultân Selîm Şâh bin Bâyezîd Hân'ım... Er isen meydâna gelesin, intizâr eylemeyesin!",
      "modern_turkish": "Ben ki İslam'ın muzaffer başkumandanı ve bidat ehlinin temellerini yıkan Sultan Selim Şah b. Bayezid Han'ım... Eğer er isen kaçmayıp er meydanına gelesin, bizi bekletmeyesin!",
      "source_work": "Münşeâtü's-Selâtîn (Cilt I, s. 378)",
      "author": "Feridun Ahmed Bey",
      "citation_reference": "Takvimhâne-i Âmire, İstanbul 1264, s. 378-382.",
      "philosophical_commentary": "Şah İsmail'in yıpratma ve yakıp yıkma taktiğine karşı doğrudan meydan savaşına davet eden, Osmanlı diplomasi dilinin en haşmetli meydan okuma belgesi."
    },
    {
      "quote_id": "QTE-007",
      "speaker": "I. Selim (Yavuz Sultan Selim)",
      "speaker_title": "Osmanlı Padişahı",
      "year": 1514,
      "event_or_context": "Çaldıran Sahrâsı Öncesi Yeniçeri Huzursuzluğu ve Çadır Kurşunlanması Hadisesi",
      "category": "sefer_ve_meydan_cengi",
      "original_text": "Biz buraya dönmek içün gelmedük! Karılarının koynuna girmek isteyenler dönsün; tek başıma dahi kalsam ben bu gazâ yolundan dönmem!",
      "transcription": "Biz buraya dönmek içün gelmedük! Karılarının koynuna girmek isteyenler dönsün; tek başıma dahi kalsam ben bu gazâ yolundan dönmem!",
      "modern_turkish": "Biz buralara geri dönmek için gelmedik! Düşman karşısında kadınlarının koynuna dönmek isteyenler varsa dönsünler; tek başıma dahi kalsam ben bu mukaddes gazâ yolundan asla dönmem!",
      "source_work": "Selimnâme",
      "author": "Celâlzâde Mustafa Çelebi",
      "citation_reference": "MEB Neşri, s. 98; Hoca Sâdeddin IV, s. 202.",
      "philosophical_commentary": "İkmal krizi yüzünden homurdanan ve otağını kurşunlayan kapıkulu ordusunu tek bir kükreyişle dize getiren çelik irade."
    },
    {
      "quote_id": "QTE-008",
      "speaker": "I. Selim (Mahlası: Selîmî)",
      "speaker_title": "Osmanlı Padişahı ve Şair",
      "year": 1515,
      "event_or_context": "Tasavvuf, Dünya Faniliği ve Mürşid-i Kâmil Beyti",
      "category": "tasavvuf_ve_siir",
      "original_text": "پادشاه عالم اولمق بر قورو غوغا ايمش / بر وليه بنده اولمق جمله دن اعلا ايمش",
      "transcription": "Pâdişâh-ı âlem olmak bir kuru gavga imiş, / Bir velîye bende olmak cümleden a'lâ imiş.",
      "modern_turkish": "Bütün cihanın padişahı olmak meğerse kuru bir kavgadan ibaretmiş; bir Hak dostuna, bir gönül velisine kul-köle olmak her şeyden daha yüceymiş.",
      "source_work": "Dîvân-ı Sultan Selim-i Evvel (Selimî)",
      "author": "I. Selim (Selîmî)",
      "citation_reference": "İstanbul Üniversitesi Nadir Eserler Kütüphanesi, TY Nu. 5420; Paul Horn Neşri, Berlin 1904.",
      "philosophical_commentary": "Tarihin en kudretli fatihlerinden birinin iktidarın zirvesinde ulaştığı tasavvufi teslimiyet ve hiçi kavrama şuuru."
    },
    {
      "quote_id": "QTE-009",
      "speaker": "I. Selim (Mahlası: Selîmî)",
      "speaker_title": "Osmanlı Padişahı",
      "year": 1516,
      "event_or_context": "İslam Dünyasının Birliği (İttihâd-ı İslâm) ve Tefrika Endişesi",
      "category": "tasavvuf_ve_siir",
      "original_text": "Milletümde ihtilâf ü tefrika endîşesi, / Kûşe-i kabrümde hattâ bî-karâr eyler beni. / İttihâdken savlet-i a'dâyı def'e çâremiz, / İttihâd etmezse millet dağ-dâr eyler beni.",
      "transcription": "Milletümde ihtilâf ü tefrika endîşesi, / Kûşe-i kabrümde hattâ bî-karâr eyler beni. / İttihâdken savlet-i a'dâyı def'e çâremiz, / İttihâd etmezse millet dağ-dâr eyler beni.",